{
  "schema_version": "1.0.0",
  "run_id": "long-multistep-full-seed3",
  "profile": "long-multistep",
  "mode": "full",
  "seed": 3,
  "started_at": "2026-09-28T13:36:59.438683Z",
  "finished_at": "2026-09-28T13:36:59.617955Z",
  "wall_clock_seconds": 0.17927169799804688,
  "source": "cluster",
  "declaration": {
    "task_id": "long-multistep-full-seed3",
    "spiffe_id": "spiffe://rig/task/long-multistep-full-seed3",
    "services": [
      "records",
      "search",
      "notify"
    ],
    "expected_duration_seconds": 23,
    "expected_step_duration_seconds": 1,
    "expected_task_duration_s": 23,
    "expected_step_duration_s": 1,
    "granularity": "task"
  },
  "steps_completed": 30,
  "write_counts": {
    "idempotent": 11,
    "versioned": 9,
    "derived": 6,
    "irreversible": 3
  },
  "metrics": {
    "reachable_set_size": 7,
    "reachable_services": [
      "analytics",
      "audit",
      "billing",
      "catalog",
      "notify",
      "records",
      "search"
    ],
    "reachable_weight": 11,
    "credential_ratio": 130.75630170092046,
    "credential_ratio_derivation": {
      "formula": "credential_ratio = tau_seconds / T_seconds",
      "tau_definition": "jwt_ttl",
      "tau_seconds": 23.0,
      "T_seconds": 0.17589974403381348,
      "credential_kind": "jwt-svid",
      "T_definition": "first to last tool call"
    },
    "tau_seconds": 23.0,
    "T_seconds": 0.17589974403381348,
    "tau_issued_epoch": 1790602619.0,
    "tau_not_after_epoch": 1790602642.0,
    "T_start_epoch": 1790602619.4387476,
    "T_end_epoch": 1790602619.6146474,
    "residual_svid_seconds": 22.345242023468018,
    "residual_policy_seconds": 0.1525568962097168,
    "residual_credential_s": 22.345242023468018,
    "residual_reach_ms": 152.5568962097168,
    "entry_deleted_at_epoch": 1790602645.656969,
    "policy_removed_at_epoch": 1790602619.8073149,
    "task_end_epoch": 1790602619.654758,
    "credential_kind": "jwt-svid",
    "jwt_ttl_requested_seconds": 23,
    "jwt_ttl_granted_seconds": 23,
    "rollback_completeness": {
      "idempotent": {
        "rho_rev": 1.0,
        "n": 11,
        "restored": 11,
        "rho_enum": 1.0,
        "rho_quarantined": 0.0,
        "rho_escalated": 0.0
      },
      "versioned": {
        "rho_rev": 1.0,
        "n": 9,
        "restored": 9,
        "rho_enum": 1.0,
        "rho_quarantined": 0.0,
        "rho_escalated": 0.0
      },
      "derived": {
        "rho_rev": null,
        "n": 6,
        "quarantined": 6,
        "rho_enum": 1.0,
        "rho_quarantined": 1.0,
        "rho_escalated": 0.0
      },
      "irreversible": {
        "rho_rev": 0.0,
        "n": 3,
        "escalated": 3,
        "rho_enum": 1.0,
        "rho_quarantined": 0.0,
        "rho_escalated": 1.0
      }
    },
    "rho_enum": 1.0,
    "verification_overhead": {
      "absolute_seconds": -0.0004757549999999997,
      "relative": -0.13175813722311014,
      "verify_ms": 1.193289,
      "total_ms": 177.187039
    },
    "segment_p_ms": 46.706199645996094,
    "segment_q_ms": 152.5568962097168,
    "step_ratio_mean": null,
    "step_ratio_max": null,
    "d_ms_mean": 46.706199645996094,
    "d_ms_max": 46.706199645996094,
    "breach_services": [
      "docs"
    ],
    "breach_intersection": [],
    "breach_intersection_size": 0,
    "gateway_403": 2
  },
  "policy_propagation_ms": [
    46.706199645996094
  ],
  "artefacts": {
    "probe": "probe.parquet",
    "flows": "flows.parquet",
    "spans": "spans.parquet",
    "lineage": "lineage.parquet",
    "groundtruth": "groundtruth.parquet",
    "svid": "svid.parquet",
    "evasion": "evasion.parquet",
    "gateway": "gateway.parquet"
  },
  "evasion_matrix": [
    {
      "row": 1,
      "id": "1",
      "probe": "direct_ip_declared",
      "target": "10.42.0.184:8081 (records pod)",
      "verdict": "allowed",
      "latency_ms": 0.9390420163981616,
      "detail": "bypass Service name; connect to pod IP of records",
      "leak": "",
      "policy_propagation_ms": 67.32296943664551,
      "probe_epoch": 1790608562.73046,
      "cnp_valid_epoch": 1790608557.729439,
      "seconds_after_cnp_valid": 5.001020908355713
    },
    {
      "row": 2,
      "id": "2",
      "probe": "direct_ip_undeclared",
      "target": "10.42.0.105:8082 (docs pod)",
      "verdict": "refused",
      "latency_ms": 2001.5673759626225,
      "detail": "pod IP of undeclared docs",
      "leak": "",
      "policy_propagation_ms": 67.32296943664551,
      "probe_epoch": 1790608562.73046,
      "cnp_valid_epoch": 1790608557.729439,
      "seconds_after_cnp_valid": 5.001020908355713
    },
    {
      "row": 3,
      "id": "3a",
      "probe": "dns_coredns_undeclared",
      "target": "docs.rig.svc.cluster.local",
      "verdict": "refused",
      "latency_ms": 12.449915986508131,
      "detail": "coredns_undeclared=refused ips=[]",
      "leak": "",
      "policy_propagation_ms": 67.32296943664551,
      "probe_epoch": 1790608562.73046,
      "cnp_valid_epoch": 1790608557.729439,
      "seconds_after_cnp_valid": 5.001020908355713
    },
    {
      "row": 4,
      "id": "3b",
      "probe": "dns_udp53_external",
      "target": "udp/53@1.1.1.1",
      "verdict": "refused",
      "latency_ms": 2002.8971260180697,
      "detail": "udp53_1.1.1.1=refused",
      "leak": "",
      "policy_propagation_ms": 67.32296943664551,
      "probe_epoch": 1790608562.73046,
      "cnp_valid_epoch": 1790608557.729439,
      "seconds_after_cnp_valid": 5.001020908355713
    },
    {
      "row": 5,
      "id": "4",
      "probe": "external_https",
      "target": "1.1.1.1:443",
      "verdict": "refused",
      "latency_ms": 2003.9837089716457,
      "detail": "documented public IP Cloudflare 1.1.1.1 TCP/443",
      "leak": "",
      "policy_propagation_ms": 67.32296943664551,
      "probe_epoch": 1790608562.73046,
      "cnp_valid_epoch": 1790608557.729439,
      "seconds_after_cnp_valid": 5.001020908355713
    },
    {
      "row": 6,
      "id": "5",
      "probe": "node_metadata",
      "target": "169.254.169.254:80",
      "verdict": "refused",
      "latency_ms": 2002.8600430232473,
      "detail": "link-local cloud metadata; k3d has no IMDS",
      "leak": "",
      "policy_propagation_ms": 67.32296943664551,
      "probe_epoch": 1790608562.73046,
      "cnp_valid_epoch": 1790608557.729439,
      "seconds_after_cnp_valid": 5.001020908355713
    },
    {
      "row": 7,
      "id": "6a",
      "probe": "kubernetes_api_name",
      "target": "kubernetes.default.svc:443",
      "verdict": "refused",
      "latency_ms": 7.86462496034801,
      "detail": "dns=refused; tcp_name=skipped",
      "leak": "",
      "policy_propagation_ms": 67.32296943664551,
      "probe_epoch": 1790608562.73046,
      "cnp_valid_epoch": 1790608557.729439,
      "seconds_after_cnp_valid": 5.001020908355713
    },
    {
      "row": 8,
      "id": "6b",
      "probe": "kubernetes_api_ip",
      "target": "10.43.0.1:443",
      "verdict": "refused",
      "latency_ms": 2002.093167975545,
      "detail": "tcp_clusterip=refused",
      "leak": "",
      "policy_propagation_ms": 67.32296943664551,
      "probe_epoch": 1790608562.73046,
      "cnp_valid_epoch": 1790608557.729439,
      "seconds_after_cnp_valid": 5.001020908355713
    },
    {
      "row": 9,
      "id": "7",
      "probe": "kubelet",
      "target": "172.18.0.3:10250",
      "verdict": "refused",
      "latency_ms": 2003.927834040951,
      "detail": "node InternalIP kubelet",
      "leak": "",
      "policy_propagation_ms": 67.32296943664551,
      "probe_epoch": 1790608562.73046,
      "cnp_valid_epoch": 1790608557.729439,
      "seconds_after_cnp_valid": 5.001020908355713
    }
  ],
  "jwt_ttl_requested_seconds": 23,
  "jwt_ttl_granted_seconds": 23
}
