{
  "schema_version": "1.0.0",
  "run_id": "long-multistep-gateway-only-seed1",
  "profile": "long-multistep",
  "mode": "gateway-only",
  "seed": 1,
  "started_at": "2026-09-28T05:08:51.867972Z",
  "finished_at": "2026-09-28T05:08:52.615544Z",
  "wall_clock_seconds": 0.7475712299346924,
  "source": "cluster",
  "declaration": {
    "task_id": "long-multistep-gateway-only-seed1",
    "spiffe_id": "spiffe://rig/task/long-multistep-gateway-only-seed1",
    "services": [
      "records",
      "search",
      "notify"
    ],
    "expected_duration_seconds": 1800,
    "granularity": "task"
  },
  "steps_completed": 30,
  "write_counts": {
    "idempotent": 11,
    "versioned": 9,
    "derived": 6,
    "irreversible": 3
  },
  "metrics": {
    "reachable_set_size": 8,
    "reachable_services": [
      "analytics",
      "audit",
      "billing",
      "catalog",
      "docs",
      "notify",
      "records",
      "search"
    ],
    "reachable_weight": 14,
    "credential_ratio": 120761.29670784484,
    "credential_ratio_derivation": {
      "formula": "credential_ratio = tau_seconds / T_seconds",
      "tau_definition": "exp - iat (SVID TTL); not issue-to-delete; not registration-entry deletion",
      "tau_seconds": 86400.0,
      "T_seconds": 0.715461015701294,
      "credential_kind": "sa-token"
    },
    "tau_seconds": 86400.0,
    "T_seconds": 0.715461015701294,
    "tau_issued_epoch": 1790572121.0,
    "tau_not_after_epoch": 1790658521.0,
    "T_start_epoch": 1790572131.8679729,
    "T_end_epoch": 1790572132.5834339,
    "residual_svid_seconds": null,
    "residual_policy_seconds": null,
    "entry_deleted_at_epoch": null,
    "policy_removed_at_epoch": null,
    "task_end_epoch": 1790572132.8193579,
    "credential_kind": "sa-token",
    "rollback_completeness": {
      "idempotent": {
        "rho_rev": 1.0,
        "n": 11,
        "restored": 11,
        "rho_enum": 1.0,
        "rho_quarantined": 0.0,
        "rho_escalated": 0.0
      },
      "versioned": {
        "rho_rev": 1.0,
        "n": 9,
        "restored": 9,
        "rho_enum": 1.0,
        "rho_quarantined": 0.0,
        "rho_escalated": 0.0
      },
      "derived": {
        "rho_rev": null,
        "n": 6,
        "quarantined": 6,
        "rho_enum": 1.0,
        "rho_quarantined": 1.0,
        "rho_escalated": 0.0
      },
      "irreversible": {
        "rho_rev": 0.0,
        "n": 3,
        "escalated": 3,
        "rho_enum": 1.0,
        "rho_quarantined": 0.0,
        "rho_escalated": 1.0
      }
    },
    "rho_enum": 1.0,
    "verification_overhead": {
      "absolute_seconds": 0.004098873,
      "relative": null,
      "verify_ms": 4.098873,
      "total_ms": 719.5599980000001
    },
    "segment_p_ms": 0.0,
    "segment_q_ms": 0.0,
    "step_ratio_mean": null,
    "step_ratio_max": null,
    "d_ms_mean": null,
    "d_ms_max": null,
    "breach_services": [
      "docs"
    ],
    "breach_intersection": [
      "docs"
    ],
    "breach_intersection_size": 1
  },
  "policy_propagation_ms": [],
  "artefacts": {
    "probe": "probe.parquet",
    "flows": "flows.parquet",
    "spans": "spans.parquet",
    "lineage": "lineage.parquet",
    "groundtruth": "groundtruth.parquet",
    "svid": "svid.parquet",
    "evasion": "evasion.parquet",
    "gateway": "gateway.parquet"
  },
  "evasion_matrix": [
    {
      "row": 1,
      "probe": "direct_ip_declared",
      "target": "10.42.0.48:8081 (records pod)",
      "verdict": "allowed",
      "latency_ms": 0.550583004951477,
      "detail": "bypass Service name; connect to pod IP of records"
    },
    {
      "row": 2,
      "probe": "direct_ip_undeclared",
      "target": "10.42.0.106:8082 (docs pod)",
      "verdict": "allowed",
      "latency_ms": 0.2775419852696359,
      "detail": "pod IP of undeclared docs"
    },
    {
      "row": 3,
      "probe": "dns",
      "target": "docs.rig.svc.cluster.local; udp/53@1.1.1.1",
      "verdict": "allowed",
      "latency_ms": 232.45045798830688,
      "detail": "coredns_undeclared=allowed ips=['10.43.249.247']; udp53_1.1.1.1=allowed"
    },
    {
      "row": 4,
      "probe": "external_https",
      "target": "1.1.1.1:443",
      "verdict": "allowed",
      "latency_ms": 22.03312498750165,
      "detail": "documented public IP Cloudflare 1.1.1.1 TCP/443"
    },
    {
      "row": 5,
      "probe": "node_metadata",
      "target": "169.254.169.254:80",
      "verdict": "error",
      "latency_ms": 8.392292016651481,
      "detail": "link-local cloud metadata; k3d has no IMDS"
    },
    {
      "row": 6,
      "probe": "kubernetes_api",
      "target": "kubernetes.default.svc:443+10.43.0.1",
      "verdict": "allowed",
      "latency_ms": 2.5373739772476256,
      "detail": "dns=allowed; tcp_name=allowed; tcp_clusterip=allowed"
    },
    {
      "row": 7,
      "probe": "kubelet",
      "target": "172.18.0.3:10250",
      "verdict": "allowed",
      "latency_ms": 0.3149170079268515,
      "detail": "node InternalIP kubelet"
    }
  ]
}
