{
  "schema_version": "1.0.0",
  "run_id": "long-multistep-flat-seed7",
  "profile": "long-multistep",
  "mode": "flat",
  "seed": 7,
  "started_at": "2026-09-28T06:40:29.888685Z",
  "finished_at": "2026-09-28T06:40:30.096403Z",
  "wall_clock_seconds": 0.2077183723449707,
  "source": "cluster",
  "declaration": {
    "task_id": "long-multistep-flat-seed7",
    "spiffe_id": "spiffe://rig/task/long-multistep-flat-seed7",
    "services": [
      "records",
      "search",
      "notify"
    ],
    "expected_duration_seconds": 1800,
    "granularity": "task"
  },
  "steps_completed": 30,
  "write_counts": {
    "idempotent": 12,
    "versioned": 10,
    "derived": 5,
    "irreversible": 3
  },
  "metrics": {
    "reachable_set_size": 8,
    "reachable_services": [
      "analytics",
      "audit",
      "billing",
      "catalog",
      "docs",
      "notify",
      "records",
      "search"
    ],
    "reachable_weight": 14,
    "credential_ratio": 422542.2475942619,
    "credential_ratio_derivation": {
      "formula": "credential_ratio = tau_seconds / T_seconds",
      "tau_definition": "exp - iat (SVID TTL); not issue-to-delete; not registration-entry deletion",
      "tau_seconds": 86400.0,
      "T_seconds": 0.20447659492492676,
      "credential_kind": "sa-token"
    },
    "tau_seconds": 86400.0,
    "T_seconds": 0.20447659492492676,
    "tau_issued_epoch": 1790577625.0,
    "tau_not_after_epoch": 1790664025.0,
    "T_start_epoch": 1790577629.8886855,
    "T_end_epoch": 1790577630.093162,
    "residual_svid_seconds": null,
    "residual_policy_seconds": null,
    "entry_deleted_at_epoch": null,
    "policy_removed_at_epoch": null,
    "task_end_epoch": 1790577630.143987,
    "credential_kind": "sa-token",
    "rollback_completeness": {
      "idempotent": {
        "rho_rev": 1.0,
        "n": 12,
        "restored": 12,
        "rho_enum": 1.0,
        "rho_quarantined": 0.0,
        "rho_escalated": 0.0
      },
      "versioned": {
        "rho_rev": 1.0,
        "n": 10,
        "restored": 10,
        "rho_enum": 1.0,
        "rho_quarantined": 0.0,
        "rho_escalated": 0.0
      },
      "derived": {
        "rho_rev": null,
        "n": 5,
        "quarantined": 5,
        "rho_enum": 1.0,
        "rho_quarantined": 1.0,
        "rho_escalated": 0.0
      },
      "irreversible": {
        "rho_rev": 0.0,
        "n": 3,
        "escalated": 3,
        "rho_enum": 1.0,
        "rho_quarantined": 0.0,
        "rho_escalated": 1.0
      }
    },
    "rho_enum": 1.0,
    "verification_overhead": {
      "absolute_seconds": 0.002652834,
      "relative": null,
      "verify_ms": 2.6528340000000004,
      "total_ms": 207.129376
    },
    "segment_p_ms": 0.0,
    "segment_q_ms": 0.0,
    "step_ratio_mean": null,
    "step_ratio_max": null,
    "d_ms_mean": null,
    "d_ms_max": null,
    "breach_services": [
      "docs"
    ],
    "breach_intersection": [
      "docs"
    ],
    "breach_intersection_size": 1
  },
  "policy_propagation_ms": [],
  "artefacts": {
    "probe": "probe.parquet",
    "flows": "flows.parquet",
    "spans": "spans.parquet",
    "lineage": "lineage.parquet",
    "groundtruth": "groundtruth.parquet",
    "svid": "svid.parquet",
    "evasion": "evasion.parquet"
  },
  "evasion_matrix": [
    {
      "row": 1,
      "id": "1",
      "probe": "direct_ip_declared",
      "target": "10.42.0.184:8081 (records pod)",
      "verdict": "allowed",
      "latency_ms": 1.2347500305622816,
      "detail": "bypass Service name; connect to pod IP of records",
      "leak": "",
      "policy_propagation_ms": 0.0,
      "probe_epoch": 1790608308.968105
    },
    {
      "row": 2,
      "id": "2",
      "probe": "direct_ip_undeclared",
      "target": "10.42.0.105:8082 (docs pod)",
      "verdict": "allowed",
      "latency_ms": 1.4472919865511358,
      "detail": "pod IP of undeclared docs",
      "leak": "",
      "policy_propagation_ms": 0.0,
      "probe_epoch": 1790608308.968105
    },
    {
      "row": 3,
      "id": "3a",
      "probe": "dns_coredns_undeclared",
      "target": "docs.rig.svc.cluster.local",
      "verdict": "allowed",
      "latency_ms": 10.321040987037122,
      "detail": "coredns_undeclared=allowed ips=['10.43.139.158']",
      "leak": "",
      "policy_propagation_ms": 0.0,
      "probe_epoch": 1790608308.968105
    },
    {
      "row": 4,
      "id": "3b",
      "probe": "dns_udp53_external",
      "target": "udp/53@1.1.1.1",
      "verdict": "allowed",
      "latency_ms": 20.48966701840982,
      "detail": "udp53_1.1.1.1=allowed",
      "leak": "",
      "policy_propagation_ms": 0.0,
      "probe_epoch": 1790608308.968105
    },
    {
      "row": 5,
      "id": "4",
      "probe": "external_https",
      "target": "1.1.1.1:443",
      "verdict": "allowed",
      "latency_ms": 21.57004101900384,
      "detail": "documented public IP Cloudflare 1.1.1.1 TCP/443",
      "leak": "",
      "policy_propagation_ms": 0.0,
      "probe_epoch": 1790608308.968105
    },
    {
      "row": 6,
      "id": "5",
      "probe": "node_metadata",
      "target": "169.254.169.254:80",
      "verdict": "host-refused",
      "latency_ms": 2008.2759180222638,
      "detail": "link-local cloud metadata; k3d has no IMDS",
      "leak": "",
      "policy_propagation_ms": 0.0,
      "probe_epoch": 1790608308.968105
    },
    {
      "row": 7,
      "id": "6a",
      "probe": "kubernetes_api_name",
      "target": "kubernetes.default.svc:443",
      "verdict": "allowed",
      "latency_ms": 4.244541982188821,
      "detail": "dns=allowed; tcp_name=allowed",
      "leak": "",
      "policy_propagation_ms": 0.0,
      "probe_epoch": 1790608308.968105
    },
    {
      "row": 8,
      "id": "6b",
      "probe": "kubernetes_api_ip",
      "target": "10.43.0.1:443",
      "verdict": "allowed",
      "latency_ms": 0.32054196344688535,
      "detail": "tcp_clusterip=allowed",
      "leak": "",
      "policy_propagation_ms": 0.0,
      "probe_epoch": 1790608308.968105
    },
    {
      "row": 9,
      "id": "7",
      "probe": "kubelet",
      "target": "172.18.0.3:10250",
      "verdict": "allowed",
      "latency_ms": 0.14712504344061017,
      "detail": "node InternalIP kubelet",
      "leak": "",
      "policy_propagation_ms": 0.0,
      "probe_epoch": 1790608308.968105
    }
  ]
}
